{
  "schema_version": "vision-webfill-browser-observation-capture-result-v1",
  "capture_id": "vwoc-80808080808080808080808080808080",
  "created_at": "2026-08-15T10:00:02+08:00",
  "state_at_creation": "COMMITTED",
  "authority": {
    "capture_action_id_hash": "d0c80b275a1200bc53ca6ae1f8dc220c7ded49db5f7c5af81e391cbde7f7bad0",
    "capture_request_hash": "b2dcf58ce16433ab472988516b5c175f54a62f3fc7e3201ce7b40ee242b4549c",
    "authenticated_principal_hash": "71f9c483cb5450a5cd2f1e04c19215ecabe7cc365453975ee9de56de7400d4fc",
    "interactive_session_hash": "c8462315c9a7e5a4901034b3643d119cc92c239f5b6b2ed3fb9bb45878b3f86d",
    "adapter_target_profile": {
      "adapter_target_profile_id": "watp-synthetic-539",
      "adapter_target_profile_version": 1,
      "profile_integrity_hash": "aaaaaaaaaaaaaaaaaaaaaaaaaaaaaaaaaaaaaaaaaaaaaaaaaaaaaaaaaaaaaaaa"
    },
    "logical_target_profile": {
      "target_profile_id": "wtp-synthetic-539",
      "target_profile_version": 1,
      "profile_integrity_hash": "bbbbbbbbbbbbbbbbbbbbbbbbbbbbbbbbbbbbbbbbbbbbbbbbbbbbbbbbbbbbbbbb"
    },
    "origin_path_policy_hash": "cccccccccccccccccccccccccccccccccccccccccccccccccccccccccccccccc",
    "page_form_contract_hash": "dddddddddddddddddddddddddddddddddddddddddddddddddddddddddddddddd",
    "idempotency_key_hash": "16bffb8cafb53670d10d97c992a6e6fe2390031e7c9b9a179b8be61f75349f49"
  },
  "browser_page_identity": {
    "schema_version": "vision-webfill-browser-page-identity-v1",
    "browser_runtime_id": "vwbr-10101010101010101010101010101010",
    "browser_session_id": "vwbs-20202020202020202020202020202020",
    "browser_connection_id": "vwbc-22222222222222222222222222222222",
    "connection_generation": 3,
    "tab_instance_id": "vwti-30303030303030303030303030303030",
    "frame_instance_id": "vwfi-40404040404040404040404040404040",
    "document_instance_id": "vwdi-50505050505050505050505050505050",
    "page_instance_id": "vwpi-60606060606060606060606060606060",
    "navigation_epoch": 7,
    "observation_generation": 2,
    "dom_mutation_generation": 19,
    "site_id": "site-synthetic-539",
    "game": "539",
    "origin_identity_hash": "eeeeeeeeeeeeeeeeeeeeeeeeeeeeeeeeeeeeeeeeeeeeeeeeeeeeeeeeeeeeeeee",
    "normalized_path_identity_hash": "ffffffffffffffffffffffffffffffffffffffffffffffffffffffffffffffff",
    "captured_at": "2026-08-15T10:00:02+08:00",
    "identity_integrity_hash": "84fe525aa4b75d0f5c0a14252dd8d227cfa709ff2f12edade81cfd407948252f",
    "safety": {
      "opaque_server_aliases_only": true,
      "raw_browser_target_id_persisted": false,
      "raw_connection_token_persisted": false,
      "raw_url_persisted": false,
      "query_or_fragment_persisted": false,
      "cookie_or_storage_identity_persisted": false,
      "credential_persisted": false
    }
  },
  "stable_capture": {
    "attempt": 1,
    "maximum_attempts": 2,
    "timeout_milliseconds": 5000,
    "started_at": "2026-08-15T10:00:00+08:00",
    "ended_at": "2026-08-15T10:00:02+08:00",
    "read_count": 2,
    "first_structure_hash": "866ff299ce63929611aaaabe671119733fe6bde411f216451cd7f2c3aa4af8af",
    "second_structure_hash": "866ff299ce63929611aaaabe671119733fe6bde411f216451cd7f2c3aa4af8af",
    "start_navigation_epoch": 7,
    "end_navigation_epoch": 7,
    "start_dom_mutation_generation": 19,
    "end_dom_mutation_generation": 19,
    "document_identity_stable": true,
    "page_identity_stable": true,
    "structure_equal": true,
    "final_precommit_check_passed": true,
    "postcommit_check_passed": true
  },
  "observation_reference": {
    "dom_observation_id": "vwdo-70707070707070707070707070707070",
    "observation_hash": "ee5ed77b23a77e29d0b746cac613d1a45e41c5721792c9689dc523fa084849ee",
    "page_fingerprint": "866ff299ce63929611aaaabe671119733fe6bde411f216451cd7f2c3aa4af8af",
    "page_instance_id": "vwpi-60606060606060606060606060606060",
    "navigation_epoch": 7,
    "observation_generation": 2,
    "dom_mutation_generation": 19,
    "committed": true
  },
  "capture_content_hash": "fd9c8f27d3c43fc3914df3b8affc115352380e2cf1b30c6ad649439deb60b904",
  "record_integrity_hash": "8b00e7b72239c8bb3c529502f496abde3bf638eac1b1b78be1c3a958e1171fcb",
  "safety": {
    "read_only_capture": true,
    "identity_reference_only": true,
    "raw_dom_values_exposed": false,
    "raw_dom_values_persisted": false,
    "raw_dom_values_hashed": false,
    "raw_html_persisted": false,
    "cookie_or_storage_read": false,
    "screenshot_captured": false,
    "arbitrary_script_executed": false,
    "browser_launched": false,
    "navigation_performed": false,
    "dom_mutation_performed": false,
    "click_performed": false,
    "typing_performed": false,
    "events_dispatched": false,
    "fill_authorized": false,
    "submit_authorized": false,
    "queue_or_claim_completed": false
  }
}
